4,doordash,Devils advocate,I have been dashing for a few months now and am new to this Reddit thread. I fail to understand why all the negativity and hostility toward doordash here.  I started dashing as a side gig to supplement my student loans in my free time. Doordash has allowed me to easily make another $200 a week with just a couple hours a day. I have tracked everyone of my dashes in a spreadsheet and average $15 an hour. Most of the time I just look for when my area is busy and dash for an hour or two. I love the flexibility  driving generally relaxes me and I only have to deal with people for a moment and 99% of those people are generally appreciate me.  I am content with the current pay system. I know upfront if the order is worth it to me. If I make anything more  well its a nice bonus.  The couple times I have had an order  i have found support to be very helpful and generally reply immediately.   I have had my share of slow restaurants but this is not DoorDash's fault. I either just wait patiently or decline the order. My main job has a fair amount of work I sometimes need to bring home so I usually just bring my tablet in and get it done while I wait.  My only complaint is of the stability of their servers. I get that things happen. Why not just relax for a few minutes  be patient and just dash when it comes back online?  This will probably be downvoted to oblivion with all the cynicism here but I am sure there are some who will agree Doordash isn't that bad.
4,lyftdrivers,Excited about joining Lyft Express after Lyft killed my old car.,I'm hoping there are cars available by this weekend 😊 I will have to drive a lot more than I did with my personal car but  I think since my car resulted in death due to exhaustion I am happy to finally make some money again.  Anyone been in a similar situation? Did it work out? Did u end up having to work yourself to death instead of your car this time?
5,EtsySellers,After using Karencheck.com to cancel an order  customer threatens legal action LOL,There was no way I was going to sell to someone who leaves 40% negative reviews  so I cancelled her $70 order and here's what she replied.   So yeah  this def confirmed she's a Karen indeed!   https://imgur.com/HsuXHl2
5,doordash,DoorDash Class Action,  I have been talking with the Law firm doing the DoorDash class action and they asked me to pass this around.  Thank you for contacting us regarding the DoorDash class action. As you know  our firm has filed a class action complaint against DoorDash  Inc. for breach of contract and unlawfully taking tips that were intended for the delivery drives. At this time  we are gathering information from individuals that have been affected.  Please answer the following questions to best of your knowledge:  1. When did you start working for DoorDash?   2. How many hours per week did you work for them?  3. On average  what do you make per week for DoorDash  4. If you no longer work for DoorDash  when did you stop working for DoorDash?  5. What city and state do you live in now?  6. What city and state have you driven for DoorDash?  7. How they understood tipping worked?  8. Did they talk to anyone at DoorDash about tipping or talk about it with other drivers?  What did they discuss?  Please email your responses along with your name  address  and phone number(s) to [intake@hgdlawfirm.com](mailto:intake@hgdlawfirm.com). Also  check out our website for updates at[https://hgdlawfirm.com/doordash-class-action-suit/](https://hgdlawfirm.com/doordash-class-action-suit/).
5,AirBnB,Found a listing where the host threatens legal action for negative reviews. This whole listing is a trip., [https://www.airbnb.com/rooms/1393654?adults=5&amp;check\_in=2020-03-24&amp;check\_out=2020-03-28&amp;source\_impression\_id=p3\_1579758337\_2XObcCZFBlrVGGQn](https://www.airbnb.com/rooms/1393654?adults=5&amp;check_in=2020-03-24&amp;check_out=2020-03-28&amp;source_impression_id=p3_1579758337_2XObcCZFBlrVGGQn)
5,Lyft,Full Month of fighting with Lyft voicemail was left for me saying nothing they will do to resolve the issue and they will never accept anymore cleaning fee claims from my account because I never submitted receipt for 25$ from two months ago,nan
5,AmazonFlexDrivers,How do you guys organize your packages?,I feel like it is highly inefficient to just stack boxes in a way that isn't arranged in an optimal order. I only started Amazon Flex this week  but as far as I know there is no way to see the package route until after you're done scanning the packages. Is there a way you guys organize the packages so you don't have to rummage them when it comes time to deliver to an address?
5,postmates,Fellow drivers whose accounts got hacked and money stolen  would you join me in a class action lawsuit?,I deliver for postmates in san diego  california. My account was hacked on july 16  and $110 was stolen from me  sent to a debit card that wasnt mine. Never clicked on fishy links  replied to spam emails  or gave out my info to someone calling me. I have reported it to support  but considering i got the typical reply of “change your password  update your banking info  the higher ups will deal with it” im guessing they wont do anything about it. I went through this subreddit and noticed that a LOT of people have had their accounts hacked and money stolen within the last  two-ish months. If postmates wont do something about this  WE WILL.  I know an attorney who specializes in class action lawsuits. He has successfully represented independent contractors who were harmed in the BP oil spill  hurricane katrina  along with many other cases. If you want to be a part of this  get your money back  and hold the hackers and postmates accountable please comment and/or message me to let me know. The case will likely only be taken if there are enough of us.
5,UberEATS,I just saw a McDonald’s cashier jump over the counter and fight an ubereats driver,Idk if this kind of stuff gets posted here but it was crazy and I thought u guys might appreciate it
5,InstacartShoppers,NEW ToS Class Action opt out clause -,**ATTENTION!: Instacart has decided to add a Waiver of Class Action to their new terms of service after they were hit with Groves et al. v. Maplebear Inc. They also an option for contractors to opt out  so they can participate in a class action suit. This clause allows for 30 days after signing the new ToS to send an opt-out email to contractor-opt-out@instacart.com. It is Highly advised to opt out of this clause in case there is another major lawsuit against Apoorva Mehta and his company. Below are quotes from the ToS regarding this topic. Anyone with questions about this topic can speak to a moderator**   &amp;#x200B;  https://preview.redd.it/2d3pas78uzd41.jpg?width=750&amp;format=pjpg&amp;auto=webp&amp;s=4edfe973b7571bf2a8754037729a5fbfda341adf  **Opt-out of Mandatory Arbitration: You can decline this mandatory arbitration provision within 30 days of accepting these Terms by emailing Instacart at** [**arbitration-opt-out@instacart.com**](mailto:arbitration-opt-out@instacart.com) **with your first and last name and stating your intent to opt-out of the arbitration provision. Note that opting out of this arbitration provision does not affect any other part of these Terms  including the provisions regarding controlling law or in which courts any disputes must be brought.**
5,doordash,Live action footage of DD Headquarters,nan
5,airbnb_hosts,Hosts file Class Action Suit against Air BnB,Air BnB changed their extenuating circumstance policy without providing the legal 30 day notice   their policy changed the word endemic to pandemic . Hosts were not given notice of this change   most hosts were working out solutions with their guests. We were in shock when Air BnB stepped in and refunded guests 100% of their booking stay at the expense of the host. I am grateful for all Air BnB has done to help us book our properties. As the years  passed   Air BnB got bigger  working with customer service has been challenging  but we made the best of it. Their latest move of refunding our guests has just about put us out of business. Nobody knew the pandemic was coming  these are hard times for everyone  but why is 100% of the burden put on the hosts? guests have the option of purchasing travel insurance  hosts do not. I found an attorney who is getting ready to begin a class action suit. There is no guarantee that we will win  but the attorney feels if 10 000 hosts join  they will most likely settle. If anyone is interested  here is the link  [https://www.traverselegal.com/contact-us-airbnb/#form](https://www.traverselegal.com/contact-us-airbnb/#form)
